{
    "id": "6a1e70e1a88782771a91808c8af9bbb7a9c26a44",
    "url": "http://localhost:8080/admin/groups/uuid-6a1e70e1a88782771a91808c8af9bbb7a9c26a44",
    "options": {
        "visible_to_all": false
    },
    "description": "Maintainers of the project",
    "group_id": 1000001,
    "owner": "Project Owners",
    "owner_id": "5c78e5fb354709eed1da0b4342c007b3c8b5f099",
    "name": "Maintainers",
    "members": [
        {
            "_account_id": 1000000,
            "name": "John Doe",
            "email": "john@example.com",
            "username": "jdoe"
        },
        {
            "_account_id": 1000002,
            "name": "Jane Smith",
            "email": "jane@example.com",
            "username": "jsmith"
        }
    ],
    "includes": [
        {
            "id": "7a2e80f2b99893882a92919d9bf9cbc8b9d37b55",
            "name": "Contributors",
            "url": "http://localhost:8080/admin/groups/uuid-7a2e80f2b99893882a92919d9bf9cbc8b9d37b55"
        }
    ],
    "created_on": "2023-01-01 10:20:30.000000000"
}
